{
  "commit_id": "cmt_00000007-0000-4000-8000-000000000007",
  "manifest_sha256": "71dd25781deb6198e71ff5e2ecd42d95f7afe6618c5f7840ab52c975e9e41288",
  "schema_version": 1,
  "sequence": 7,
  "vault_id": "vlt_00000001-0000-4000-8000-000000000001",
  "host_authority_hash": "bbbbbbbbbbbbbbbbbbbbbbbbbbbbbbbbbbbbbbbbbbbbbbbbbbbbbbbbbbbbbbbb"
}
